{
  "format": "gboard-version-bindings.v1",
  "target_version": "18.5.4",
  "profile_version": "1.2.0",
  "projection_sha256": "5dbadf3216b6562cec25ad0465e06d03098b242fdfc46772eb616340db95d114",
  "profile_sha256": "e87800d2117274c1e201426346111f7dbb1e171cb6d0149efd6ae87304deb2ba",
  "port_bundle_sha256": "042b37e4f3644ed18f77c61fee545f7b56d3cd3077c9da38047bf83c2424f593",
  "bindings": {
    "amoled_theme_color_token_constructor": {
      "kind": "method",
      "class_type": "Lqyj;",
      "method_name": "<init>",
      "parameter_types": [
        "Landroid/content/Context;",
        "Z"
      ],
      "return_type": "V",
      "confidence": 0.99
    },
    "ap_catalog_copy": {
      "kind": "method",
      "class_type": "Lwpa;",
      "method_name": "n",
      "parameter_types": [
        "Ljava/util/Collection;"
      ],
      "return_type": "Lwpa;",
      "confidence": 0.9
    },
    "ap_controller_order_field": {
      "kind": "field",
      "class_type": "Lmwv;",
      "field_name": "g",
      "field_type": "Lmwg;",
      "confidence": 0.9
    },
    "ap_descriptor_action": {
      "kind": "method",
      "class_type": "Lmtm;",
      "method_name": "q",
      "parameter_types": [
        "Ljava/lang/Runnable;"
      ],
      "return_type": "V",
      "confidence": 0.9
    },
    "ap_descriptor_actions": {
      "kind": "field",
      "class_type": "Lmtm;",
      "field_name": "e",
      "field_type": "Lwnz;",
      "confidence": 0.9
    },
    "ap_descriptor_build": {
      "kind": "method",
      "class_type": "Lmtm;",
      "method_name": "a",
      "parameter_types": [],
      "return_type": "Lmtr;",
      "confidence": 0.9
    },
    "ap_descriptor_factory": {
      "kind": "method",
      "class_type": "Lmtr;",
      "method_name": "c",
      "parameter_types": [],
      "return_type": "Lmtm;",
      "confidence": 0.9
    },
    "ap_descriptor_icon": {
      "kind": "method",
      "class_type": "Lmtm;",
      "method_name": "i",
      "parameter_types": [
        "I"
      ],
      "return_type": "V",
      "confidence": 0.9
    },
    "ap_descriptor_label": {
      "kind": "field",
      "class_type": "Lmtm;",
      "field_name": "d",
      "field_type": "Ljava/lang/String;",
      "confidence": 0.9
    },
    "ap_descriptor_register": {
      "kind": "method",
      "class_type": "Lmwv;",
      "method_name": "g",
      "parameter_types": [
        "Lmtr;",
        "Z"
      ],
      "return_type": "V",
      "confidence": 0.9
    },
    "ap_descriptor_token": {
      "kind": "method",
      "class_type": "Lmtm;",
      "method_name": "l",
      "parameter_types": [
        "Ljava/lang/String;"
      ],
      "return_type": "V",
      "confidence": 0.9
    },
    "ap_master_catalog_set": {
      "kind": "field",
      "class_type": "Lmwg;",
      "field_name": "c",
      "field_type": "Lwpa;",
      "confidence": 0.9
    },
    "calculator_hidden": {
      "kind": "method",
      "class_type": "Lphr;",
      "method_name": "onWindowHidden",
      "parameter_types": [],
      "return_type": "V",
      "confidence": 0.9
    },
    "calculator_input_start": {
      "kind": "method",
      "class_type": "Lphr;",
      "method_name": "onStartInputView",
      "parameter_types": [
        "Landroid/view/inputmethod/EditorInfo;",
        "Z"
      ],
      "return_type": "V",
      "confidence": 0.9
    },
    "calculator_input_view": {
      "kind": "field",
      "class_type": "Lphr;",
      "field_name": "i",
      "field_type": "Lcom/google/android/libraries/inputmethod/inputview/InputView;",
      "confidence": 0.9
    },
    "calculator_selection": {
      "kind": "method",
      "class_type": "Lphr;",
      "method_name": "onUpdateSelection",
      "parameter_types": [
        "I",
        "I",
        "I",
        "I",
        "I",
        "I"
      ],
      "return_type": "V",
      "confidence": 0.9
    },
    "clipboard_adapter_context": {
      "kind": "field",
      "class_type": "Lfqn;",
      "field_name": "e",
      "field_type": "Landroid/content/Context;",
      "confidence": 0.9
    },
    "clipboard_adapter_items": {
      "kind": "field",
      "class_type": "Lfqn;",
      "field_name": "n",
      "field_type": "Ljava/util/List;",
      "confidence": 0.9
    },
    "clipboard_adapter_recycler": {
      "kind": "field",
      "class_type": "Lfqn;",
      "field_name": "j",
      "field_type": "Landroid/support/v7/widget/RecyclerView;",
      "confidence": 0.9
    },
    "clipboard_cleanup_cursor": {
      "kind": "method",
      "class_type": "Lfqx;",
      "method_name": "t",
      "parameter_types": [
        "Landroid/database/Cursor;"
      ],
      "return_type": "V",
      "confidence": 0.9
    },
    "clipboard_clip_id": {
      "kind": "field",
      "class_type": "Lfpk;",
      "field_name": "d",
      "field_type": "J",
      "confidence": 0.9
    },
    "clipboard_clip_model": {
      "kind": "field",
      "class_type": "Lfpk;",
      "field_name": "g",
      "field_type": "Lfpm;",
      "confidence": 0.9
    },
    "clipboard_clip_timestamp": {
      "kind": "field",
      "class_type": "Lfpk;",
      "field_name": "e",
      "field_type": "Lj$/time/Instant;",
      "confidence": 0.9
    },
    "clipboard_columns": {
      "kind": "method",
      "class_type": "Lcom/google/android/apps/inputmethod/libs/clipboard/ClipboardKeyboard;",
      "method_name": "l",
      "parameter_types": [],
      "return_type": "I",
      "confidence": 0.9
    },
    "clipboard_delete": {
      "kind": "method",
      "class_type": "Lfqr;",
      "method_name": "h",
      "parameter_types": [
        "Landroid/content/Context;",
        "Ljava/util/List;"
      ],
      "return_type": "V",
      "confidence": 0.9
    },
    "clipboard_grid_manager_constructor": {
      "kind": "method",
      "class_type": "Lfrf;",
      "method_name": "<init>",
      "parameter_types": [
        "Lcom/google/android/apps/inputmethod/libs/clipboard/ClipboardKeyboard;",
        "I",
        "Landroid/support/v7/widget/RecyclerView;"
      ],
      "return_type": "V",
      "confidence": 0.9
    },
    "clipboard_holder_text": {
      "kind": "field",
      "class_type": "Lfql;",
      "field_name": "t",
      "field_type": "Landroid/widget/TextView;",
      "confidence": 0.9
    },
    "clipboard_is_pinned": {
      "kind": "method",
      "class_type": "Lfpk;",
      "method_name": "n",
      "parameter_types": [],
      "return_type": "Z",
      "confidence": 0.9
    },
    "clipboard_is_sensitive": {
      "kind": "method",
      "class_type": "Lfpk;",
      "method_name": "m",
      "parameter_types": [],
      "return_type": "Z",
      "confidence": 0.9
    },
    "clipboard_is_special": {
      "kind": "method",
      "class_type": "Lfpk;",
      "method_name": "o",
      "parameter_types": [],
      "return_type": "Z",
      "confidence": 0.9
    },
    "clipboard_item_bind": {
      "kind": "method",
      "class_type": "Lfqn;",
      "method_name": "p",
      "parameter_types": [
        "Lkr;",
        "I"
      ],
      "return_type": "V",
      "confidence": 0.9
    },
    "clipboard_keyboard_adapter": {
      "kind": "field",
      "class_type": "Lcom/google/android/apps/inputmethod/libs/clipboard/ClipboardKeyboard;",
      "field_name": "c",
      "field_type": "Lfqn;",
      "confidence": 0.9
    },
    "clipboard_keyboard_context": {
      "kind": "field",
      "class_type": "Lcom/google/android/libraries/inputmethod/keyboard/impl/AbstractKeyboard;",
      "field_name": "z",
      "field_type": "Landroid/content/Context;",
      "confidence": 0.9
    },
    "clipboard_layout_built": {
      "kind": "method",
      "class_type": "Lcom/google/android/apps/inputmethod/libs/clipboard/ClipboardKeyboard;",
      "method_name": "e",
      "parameter_types": [
        "Landroid/view/inputmethod/EditorInfo;",
        "Ljava/lang/Object;"
      ],
      "return_type": "V",
      "confidence": 0.9
    },
    "clipboard_loader": {
      "kind": "method",
      "class_type": "Lfpn;",
      "method_name": "call",
      "parameter_types": [],
      "return_type": "Ljava/lang/Object;",
      "confidence": 0.9
    },
    "clipboard_loader_context": {
      "kind": "field",
      "class_type": "Lfpo;",
      "field_name": "b",
      "field_type": "Landroid/content/Context;",
      "confidence": 0.9
    },
    "clipboard_loader_owner": {
      "kind": "field",
      "class_type": "Lfpn;",
      "field_name": "a",
      "field_type": "Lfpo;",
      "confidence": 0.9
    },
    "clipboard_model_sensitive": {
      "kind": "field",
      "class_type": "Lfpm;",
      "field_name": "h",
      "field_type": "Z",
      "confidence": 0.9
    },
    "clipboard_model_text": {
      "kind": "field",
      "class_type": "Lfpm;",
      "field_name": "a",
      "field_type": "Ljava/lang/String;",
      "confidence": 0.9
    },
    "clipboard_model_type": {
      "kind": "field",
      "class_type": "Lfpm;",
      "field_name": "c",
      "field_type": "I",
      "confidence": 0.9
    },
    "clipboard_notify_removed": {
      "kind": "method",
      "class_type": "Ljt;",
      "method_name": "n",
      "parameter_types": [
        "I"
      ],
      "return_type": "V",
      "confidence": 0.9
    },
    "clipboard_pinned_count": {
      "kind": "field",
      "class_type": "Lfqn;",
      "field_name": "z",
      "field_type": "I",
      "confidence": 0.9
    },
    "clipboard_pinned_header": {
      "kind": "field",
      "class_type": "Lfpk;",
      "field_name": "b",
      "field_type": "Lfpk;",
      "confidence": 0.9
    },
    "clipboard_preferences": {
      "kind": "method",
      "class_type": "Lqvt;",
      "method_name": "I",
      "parameter_types": [
        "Landroid/content/Context;"
      ],
      "return_type": "Lqvt;",
      "confidence": 0.9
    },
    "clipboard_primary_timestamp": {
      "kind": "method",
      "class_type": "Lfqx;",
      "method_name": "a",
      "parameter_types": [